3月11日被通知成为密接需要开始隔离说明自己孕晚期情况申请了陪同隔离同时申请能转居家隔离当天被送去条件巨差的福田新洲如家驿站12日线上申请居家隔离通过13日却在没有任何解释说明的情况下被跨区转移去了非常偏远的大鹏各种尝试电话打到区疾控中心才知道疾控中心考虑流调和实际情况一开始给到街道的建议就是居家隔离在新的隔离酒店住下耐心等通知14日凌晨接到司机电话说已经安排车可以随时接我们考虑到7天7检还差一天主动提出等最后一天核酸结果出来风险更低再走结果从14日开始每天情况都在变化16日说需要街道正式开函给酒店才能转移正式开函需要从社区到街道到福田区再到大鹏区再到酒店17号又通知需要准老师写情况说明和免责声明免责转移过程中如果有任何身体不适由本人负责没人能告知流程到底要多久才能走完没人知道为什么我13日会被跨区转移到附近都没有合资格接诊医院的地方我莫名其妙被转移出区的时候没人担心我的身体在转移过程中会有问题可能需要担责现在要转回去了反而谨慎地需要本人写免责声明才行非常非常理解所有的社区街道酒店防疫工作人员最近有多幸苦但不理解为什么整个流程会如此不公开以及纠正之前的错误会这么难整个过程也的确感觉到很多时间人力甚至财力上的浪费上午跟找得到的街道工作人员电话情绪控不住有点激动但真的很无奈希望投诉有用流程不要再加长了	2
疫情当下 美业人在行动	1
现实版六大门派围攻光明顶	2
香港是没控制好深圳很艰难	2
空气炸锅出炉的下午茶来了来了疫情封闭在家空气炸锅越用越顺了	1
封城下的深圳 1全小区做核酸2隔着栏杆卖菜3依旧美丽的春天有年轻人感叹青春才几年疫情就三年祈祷早日安宁[合十]	1
所以深圳今天到底哪里能做核酸 宝安区西乡街道就两个采集器核酸都要过48小时了 明天怎么坐公共交通 进入办公场所搞笑呢	2
30次阴性都不能证明我们没病难道我们这些小区的人是制造生化武器的嘛自己能发明变异毒株潜伏期超过一个月	2
疫情快点好俺才能玩	1
记录一下做姜撞奶失败的第101次疫情期间更加emo 了	2
全深圳复工的前一天楼栋临时管控了大晚上11点送来一份餐不吃浪费吃吧时间属实有点晚了 还不错明天吃炒饭	1
志愿者都是最美逆行者致敬鹏城英雄	1
就这样耗下去多少人破产源头不管香港还继续放进来这样下去看你经济崩不崩美国等着看笑话	2
养宠人团结在一起坚决不走打电话问市长热线卫健委是否有通知和红头文件要求转移硬嗑不给解决方案不走之前北京大兴就是硬嗑才解决的可以看我的微博从去年开始一直在发声有成功案例可以借鉴一下	1
居家第22天2020年疫情我都没有错过春天我担心今年居家的我解封出来已错过春天	2
越来越离谱了	2
深圳什么时候才能结束啊清明回不去了五一能回去吗五一回不去我真的会发疯	2
深圳市宝安区沙井街道疫情温馨提示因突发疫情防范要求衙边辛养沙蚝东塘沙井5个社区从21日起急需开展连续4天的每天区域核酸检测请上述5个社区居民就近核酸采样3月16日至3月19日去过衙边社区南街鱼塘边公共厕所的居民请马上向社区报备	0
生活嘛慢慢来你又不差	1
武汉一夜封城 只是听闻深圳一夜控城 却是亲历我想回家了	2
3月16日深圳新增91例病例在重点区域重点人群和社区筛查中发现34例新增病例3月16日0-24时深圳新增91例病例其中71例诊断为新冠肺炎确诊病例20例诊断为新冠病毒无症状感染者；57例在隔离观察的密接人员排查中发现23例在重点区域筛查中发现4例在重点人群筛查中发现7例在社区筛查中发现新增病例情况如下??3月16日深圳在隔离观察的密接者中发现57例在重点区域重点人群和社区筛查中发现34例新增病例	0
睡觉不做梦睡醒了又睡回笼觉就一直做梦有没有同感的	0
深圳教师出征抗疫前线自娱自乐“舞”火社交平台3月21日	1
坐标深圳福田路上车都没几个了这些大货车拉的是方舱医院吗	0
本来可以吃爱情的苦却被这疫情困住了	2
解封了 姐也疯了	2
深圳的领导干部应该全部革职了	0
居家第七天全城一起等通知	0
深圳终于恢复了她本来的模样	1
深圳加油 当我躺在天桥上纸皮铺的床位上停下了一天的忙碌想到志愿工作者们的艰辛谢谢你们原来真的并没有谁愿意去冒着风险去做这样的事情也只是他们愿意奉献自己的一份力量传递正能量所以希望大家好好配合好好居家做好个人防护早早筛查完成就又恢复深圳活力了对吧	1
仿佛回到了那个出行都得凭通行证的年代	0
这些故事真的让人叹息	2
全市党政机关企事业单位生产经营单位等恢复正常工作秩序和生产经营公交地铁全面恢复运行确保产业链供应链安全稳定确保群众正常生产生活平稳有序	0
明天解封吗	0
携手抗疫 静待花开	1
好馋早餐店的糯玉米 烧麦 包子 还想吃火锅 这破疫情什么时候能停啊想堂食了馋的很	2
这么密集排队做核酸万一有个怎么办	2
下一个愿望深圳摘星深圳	1
3月19日深圳在隔离观察的密接者中发现37例在重点区域重点人群和社区筛查中发现29例新增病例3月19日0-24时深圳新增66例病例其中1例在社区筛查中发现7例在重点人群筛查中发现21例在重点区域筛查中发现37例在隔离观察的密接人员排查中发现；49例诊断为新冠肺炎确诊病例17例诊断为新冠病毒无症状感染者详情戳↓↓3月19日深圳在隔离观察的密接者中发现37例在重点区域重点人群和社区筛查中发现29例新增病例	0
昔日的美好已不在	2
每日一画 第490天 疫情期间重感冒了用了一箩筐纸手绘	2
《谢谢你》为深圳抗疫加油为深圳疫情防控做出努力和贡献的每一个人谢谢你	1
两个女孩子用飘落在地上的木棉花拼出了“深圳加油”的字样路过的行人也不由自主的停下来看着这一幕街上倒是没有什么车辆想必在两个女孩子的心里最期盼的事情就是深圳能早日恢复以前的日子正常的上下班正常的过日子不用再停工待在家里不用再担心去哪里找活干毕竟生活在深圳这里还是有一定的压力的深圳的木棉花在春天里正开的漂亮希望深圳也能在这春天里焕发出它该有的生命力依然是那个快节奏车水马龙的深圳	1
疫情面前没有旁观者疫情防控没有局外人只要认真遵守『防疫规则』希望总比病毒蔓延得快毕竟春天是万物更新旧疾当愈的美丽季节呀	1
希望大家都能有一个健康的身体好好吃饭少熬夜作息紊乱会导致掉发情绪易怒焦虑心肺和呼吸系统都会出现问题和生命相比所有的一切都不值一提我们都要活得长活得久才会在未来的某一刻迎来转机我们都要平安才好	1
谁能医疗援助一下宝安区给您跪下磕头了	2
这个病例79-92是啥情况啊怎么完全没有描述	2
宝安 核酸请看看千千万万宝安区卑微打工仔的心声已经不是第一天这样了	2
这是要给电动车做核酸	1
快把我放出去 我要和最好的朋友去海边玩	1
从2月22日到3月8日被封9号开始解封了三天还没好好的感受12日又被封到现在现在 而我们依然在等通知	2
周末继续留守单位晚上找点娱乐临时学的个网红歌曲《月老掉线》用车上放着的 自弹唱对月当歌乐呵下	1
福田区都临时交通管制了	0
在深圳的九天愿再见时你繁花似锦车水马龙	1
麻烦大家关注一下新洲北村的居民吧	2
疫情结束后你最想见谁	0
新增了91例 妈呀	2
深圳真的挺热的大白那身装备看着就够难受的社区工作人员得挨家挨户的查核酸不停敲门有的老房子还得爬78楼真挺累的大家及时开门打开粤康码叭	1
小区老人小孩核酸检测时间花费久但大白非常的耐心现在所有业主名字清单贴在大楼的出入口谁没做核酸打个X这不太合适吧网格员有这权限吗	2
坚决防止一刀切	2
今天一早上就接到一个诈骗电话来电的人报我名字也报错了说话也说不利索我只尊重专业 讽刺道哥你做诈骗也好歹尊重点做到位些吧对面去你我就挂了疫情居家跟电信诈骗分子过招真的是神清气爽 就是仿佛有个坏人知道你在家很无聊送上门给你骂一样	1
打了很长一段话最终还是删了	0
我之前跟朋友说深圳是个有爱的城市 我相信政府能妥善安置好宠物的 事实证明是我太乐观了 现实是如此令人心寒 2022年了防疫还会防成这样 这真的是深圳吗我们理解配合 但并不意味着放弃合理诉求 希望后续能看到深圳作为大城市应有的仁爱和担当	2
一场规模空前耗资巨大的行为艺术 深圳疫情自己每个月缴钱雇佣的物业锁了那么久有的人看病不及死了有的人需要开待死证明才能出门解封了需要欢呼感恩吗对于喜欢封控的人你径自待在家里不出门就行了物业封不封别人都不影响你自我隔离为什么要拉着别人跟你一起封控呢	2
再不解封姐就疯了	2
不关起来很多人受感染真的关起来很多人会死会疯	2
香港人给深圳磕一个不过分吧	2
隔离7天因为见不上面跟对象分手了因为闲天天刷抖音被抖音直播掏空了钱包妈的	2
南山防范区明天还可以去上班吗社区一直回复等通知	2
深圳人进入7天慢生活 有温度有担当的深圳人加油	1
当我的手机全是政务短信而且卫总还没发推文的时候慌得一匹	2
村外的咖啡倍香	1
所以到底什么时候恢复呢不管是国际快递还是普通快递依然不能发深圳 已经到的国际快递积压在邮局不允许自提 我不知道这样的日子什么时候是个头 这是很重要的问题好吗如果不能买东西 打工赚钱有什么用呢	2
好想回家在等疫情结束	2
我就一天没下楼去做核酸街道办就打电话来催促告诉我你要变黄码了 疫情期间2天不做核酸立马变红码	2
帮帮他们吧	1
龙华绿景香颂出现疫情疫情远比想象的严重这基本是社区传播了之前既不是管控区也不是封控区	2
向往自由	1
记录居家办公的第3天深圳	0
目前不能下楼活动了	0
每天除了做核酸没别了做到怀疑人生	2
社恐第一次在大群里怼人鼓足了好大的勇气	1
想过正常的日子正常上下班正常周末约朋友逛街吃饭	1
居家办公摸鱼不止是厨艺大赛更多的去享受生活	1
楼道里面的垃圾	0
希望疫情早日结束	1
深圳领导脑子在想什么一个核酸点都没有又要求48小时到想怎么样 深圳	2
3月17日深圳新增105例病例轨迹涉5区3月17日024时深圳新增69例新冠肺炎确诊病例和36例新冠病毒无症状感染者；其中49例在隔离观察的密接人员排查中发现28例在重点区域筛查中发现17例在重点人群筛查中发现11例在社区筛查中发现	0
尽微薄之力平淡的日子也希望可以闪闪发光	1
再不解封我就要疯了	2
今天的大白超级温柔呜呜呜	1
吉林省的疫情有点严重特别是长春市吉林市	2
走了十分钟还看不到尽头救命	2
解封后这是自由的感觉	1
深圳发布复工复产通知全市地铁公交全面恢复运行	0
3月16日深圳在隔离观察的密接者中发现57例在重点区域重点人群和社区筛查中发现34例新增病例	0
“疫情”早点过去吧看着这么小的孩子真的很心疼	2
头伸过来说啊啊啊谁家的小孩独立的自己坐着测	1
换古代你们妥妥的都是大门不出二门不迈的大家闺秀	1
还开精选了真贱呀你	2
为“情”所困疫情的情的日子里宅在家里看看洋葱发芽然后茁壮成长也是极好的	1
深圳解封了大家欢呼这一次封城已经把很多人搞的精疲力尽难以想象再来一次封城会发生什么	1
夏天的微风四季的蚊子慢下来的日子好起来的深圳	1
一起来猜猜明天明天能解封吗	0
吉林市隔离方舱建设进展 实地探访关注截至15日24时吉林省吉林市本轮疫情累计本土确诊4472例目前吉林市高新南区隔离方舱已开工建设吉林市新建隔离方舱计划设6000间房间此刻300余台挖掘机等设备进场同时作业24小时施工预计6天竣工关注最新进展 吉林省新增1456例本土确诊南京行程码上海新增5例本土确诊197无症状辽宁新增本土确诊32例北京新增本土确诊9例无症状1例河北新增本土确诊38例河北新增239例本土无症状山东新增本土确诊75例山东新增本土无症状105例待疫情消散我们再相约吉林广东新增59例本土确诊深圳新增55例本土确诊吉林新增1139例本土确诊吉林新增370例本土无症状河北新增38例本土确诊239例无症状廊坊新增225例本土无症状南京新增1个高风险5个中风险地区南京行程码上海新增5例本土确诊197无症状3月15日新增确诊病例1952例南京新增1个高风险5个中风险地区辽宁新增本土确诊32例	0
大家是不从未见过这样的深圳因为疫情感觉周边的一切都安静了愿一切安好顺利度过	1
终于可以出门了	1
且不能说账不能这么算单说这眼光是够短浅的不只是为了这600多例更是为了全深圳市1700多万市民	2
小区出不去了收到小梁同学投喂西多士配港奶 十分满足疫情早点过去吧	1
做核酸不会影响你们上网课的放心好啦有绿色通道做完核酸赶快回家上课不要想合理翘课	1
能不能来个人告诉我一下为什么深圳到现在了还是每天都在新增病例到底是哪儿来的呀	2
若有战 召必回 战必胜	1
深圳政府要求停工在到处都是疫情威胁下我们社区竟然还放任人员自由出入根本没有所谓的封村拿工牌就可以去上班我的同事一句家里没网一句轻飘飘的所谓封控睁眼说瞎话大家都是拿着工牌去上班他凭什么不来一个人干两个人的活忙得死去活来别人的命是命我的命不是命吗	2
3月16日虎气来了 香港新增29272确诊	0
深圳大学总医院门诊紧急暂停该医院称接上级部门协查通知根据国家和本市疫情防控要求我院3月19日暂停门诊急诊医疗服务复诊时间请关注医院通知	0
被按下了暂停键一个美国鬼老鼠屎搞得整个世界乌烟瘴气这TM这个疫情神马时候是个头到处封很不方便疫情期间在家莫要出行做好	2
不封香港当初福田不敢全封现在拉了个74年副局顶现在病例还那么多“没能力就是没能力不要怪什么大环境”	2
地址新桥街道象山区芙蓉公园隔离第七天今天能解封吗周一能正常开工吗	0
解封后要吃一顿牛肉火锅	1
出了转移的正式通知希望执行的像通知里说的一样漂亮	1
心疼我的朋友 心疼疫情中的每一个人	1
家里的网络搞好了小区全封闭的情况下多亏了美团外卖小哥帮我带回我的路由器这年头真的是没什么不能没网络久违的打开了自己的笔记本放着舒缓的音乐不紧不慢的办公天气开始炎热起来了又到了开空调的季节希望这炎热的天气能让这疫情尽快离开我们Ps图片来自	1
昨天有个邻居吃鱼卡到喉咙了结果还要让救护车送去医院会来还要等救护车送回来太惨了去一趟医院废了6个小时其实医院步行就十分钟但因为是封控区所以必须要救护车接送	2
能收快递吗	0
深圳什么时候可以发快递苦等	2
停工的第三天 居家更辛苦哇心焦	2
管控的日子感谢大白们	1
今天全深圳人都在等待明天到底能不能解封	2
同心抗疫共克时坚蛙来哒供应链与深圳战区协作为龙岗新联街道罗湖黄贝街道等抗疫工作站送去物资抗击疫情我们在路上	1
居家的第四天	0
相信政府等到的是新增人数越来越多坐标上沙这里已经被封了快一个月了想不通为什么还是越来越多加油两字都快听吐了	2
这疫情一步一步向我们逼近好焦虑啊	2
要48h核酸 又不设置核酸点我已经排了一个小时的队了还没排到一半	2
有的人真是没有素质核酸检测排队又抽烟又吐痰 口罩就没戴上过	2
福田这通知是体育老师写的吧全福田的人现在都在抓耳挠腮做阅读理解	2
深圳市宝安区沙井街道应急管理办公室通报3月11日以来我办累计查封控停企业 8 家现场督导纠正企业 55 家违反防疫政策控停企业名单深圳市信维通信股份有限公司深圳市高尔夫飞煌科技有限公司深圳市协力达精密科技有限公司深圳市环浩环保科技有限公司深圳通达电子有限公司深圳市正晋昌科技有限公司深圳市大富科技股份有限公司深圳市华生电机有限公司下一步我办将进一步加大巡查执法力度督促企业落实疫情防控主体责任对擅自开工造成严重负面影响的将依法采取强制措施特此通报	0
《让动再动》核酸检测人人动叫到哪栋哪栋动未叫楼栋不要动动了下来也没用	0
深圳跨境货车配专车监督司机从头至尾尾随跨境货车	0
看到这个核酸点着实让人心酸宝安人民太艰难了昨天找了一圈没有测到今天也没去公司马上就要72小时无奈跑去了一个好远的社康自费明天应该可以正常打工了	2
扛主机回家的打工人开始复工了	1
今天是大白呀	1
体验一下	0
你们明天就解放了而我还有13天	2
10分钟了卫总睡过头了吗	2
深圳封控地图3月21日更新宝安中心区的封控区域比一星期以前多了不少希望疫情早日过去	1
深圳加油自己包的云吞一点不输外边	1
什么时候能出个投诉渠道	2
家里存粮不多了明天终于解封啦	1
深圳5个区解除“缓慢键”模式据市政府一已实现社会面动态清零的盐田区坪山区光明区大鹏新区深汕特别合作区党政机关企事业单位生产经营单位等恢复正常工作秩序和生产经营公交地铁恢复运行封控区管控区防范区严格执行疫情防控相关措施二其他未实现社会面动态清零的区域要做好精准防控努力用最小的代价实现最大的防控效果最大限度减少疫情对经济社会发展的影响加大企业服务力度分区分级分类实施差异化疫情防控措施实施“一企一策”“一厂一案”保障企业有序生产经营三要做好统筹协调全力保障交通运输顺畅确保企业物流畅通	0
你他妈睡得着吗我都担心死我家人了从深圳的人别回来了求求了我好崩溃	2
广东3月17日确诊74例其中深圳市69例东莞市4例珠海市1例；无症状61例其中深圳市36例东莞市25例对比前一日确诊83例其中深圳市71例东莞市7例广州市4例珠海市1例；无症状70例其中东莞市45例深圳市20例广州市2例汕尾市2例惠州市1例看数据广东疫情主战场目前主要在深圳市数据面看仍在维持居民还得再坚持坚持；东莞两方面数据已处于下行通道了只要保持现有措施应该很快迎来曙光	0
刚才下楼做第三轮核酸啊下凡太好玩了难怪七仙女不想回天上	1
广东省客家商会党支部组织党员志愿者助力基层疫情防控工作	0
在家这段时间纸巾用的就是快好了我要擦屁股了	1
居家办公也不要亏待自己	1
320深圳飞上海能正常飞吗孩子憋坏了	2
转无人机喊话做核酸服了服了	1
这二位思路很清晰已经出现了太多对宠物不利的事件了任谁都不能轻易放心	2
所以明天能解封了吗	0
亚马逊电脑是搬回家了电费是要自己掏了疫情快结束不然我夏天都开不起空调了	2
疫情期间还拿别人点的东西的人真是恶心	2
因为疫情在家里呆了十多天今天终于出来了抬头看天空灰蒙蒙的下着小雨路边的冒着新芽的树路边由工作人员正在清扫掉落的树叶路边马路车辆川流不息这样的场景似乎好久没有看到了开心的想要跳着走路能出来真好	1
广西严防边境输入也是亚历山大啊本深圳居民经历过这两个月明白广西有多不容易了	1
居家办公Day4早上吃的好舒服呀有点家里的感觉要是有家里的叶菜就完美了午餐太多了这么一大碗都吃完了撑一下午晚上也没吃饭切了水果吃水果也整多了今天吃多了的一天	1
来自微信各户好友的慰问听说你们整个村都要被拉去隔离我麻了 这个问题我都回答麻了	2
目前最严峻的是第一批转运隔离的居民宠物有大量滞留在家里无人看管有些甚至已经处于断粮状态恳请有关志愿者优先处理这部分滞留宠物	2
宝安加油西乡加油好想回去支援	1
听着窗外下雨的声音而我却因为疫情没能上班而失眠同时也希望广西藤县不要下雨战士们真的很辛苦希望真相早日找到希望所有人的希望都有希望	1
说的全市封村拿着工牌就放行让人出去上班恶意传播疫情无视深圳市政府疫情规定说什么居家办公我跟我另一个同事住一个社区就要天天去冒着感染的风险去上班我的老板知道我住这里是不管的随意让人出入逼着我们去上班可怜虫我的装逼同事臭鸟人找借口说家里没网出不来就什么都不干我看他是死在出租屋了臭了没人发现两个人干4个人的工作量干到死干到没停过要给老板上班上到确诊才让人休息吗	2
网友投稿光明区某城中村总有些人不自觉	2
总是有爱在隔离疫不容辞共同守圳	1
吃完一顿丰盛又美味的早餐开始干活三人一组扫楼采样入户消杀	1
非常时期真正体会了什么叫“有权利不用明天作废”政策不停在变昨天还能出去放风的今天就不行了再问明天呢等通知	2
sossos	2
明天终于解封了终于可以出去逛街透透气了今晚赶紧把剩余的物质拿来霍霍一顿	1
看别人是故事看自己就是事故 你不转我不转轮到自己没人管	2
据说附近的朴朴超市有十几个外卖小哥感染沃尔玛也封了还有短信提醒宝安其他地区开始拒绝西乡的人过去宝安是深圳几大区人口最密集的地方可怜的西乡也要沦陷了么西乡挺住宝安挺住深圳加油	1
没有进出卡买菜都出不去说要出去就登记然后后果自负说昨天发了1000多张出入卡都发完了我说我没有接到通知领啊人家说没领是你的问题不是我的问题反正我发完了回来在楼下碰到同一栋的邻居问她有领到出入证吗她说没有领到问在哪里领啊打电话给深小卫公布的社区电话让帮忙核实一下情况社区接电话的工作人员说不可能自己的家人都领到了然后挂了我电话唉	2
发去威海的快递原路退回了揭阳 疫情 前天晚上在美团买的菜本来今天配送早上起来看到美团凌晨3点退款了 立马戴上口罩去超市囤了点菜经过上次看到超市抢菜的情景看到人不多我赶紧选好去打称和买单其实菜市都是正常供应的只是怕万一还是屯点粮刚刚房东来给了我出行卡	1
形势严峻感谢 美小护们奔赴一线阻击新冠辛苦了 因为有你们我们坚信深圳能赢	1
所以到底 什么时候恢复呢不管是国际快递还是普通快递依然不能发深圳 已经到的国际快递积压在邮局不允许自提 我不知道这样的日子什么时候是个头 这是很重要的问题好吗如果不能买东西 打工赚钱有什么用呢	2
不知道说啥了每天核酸开始时间都不一样但是从不通知或者晚通知前天八点开始昨天七点开始今天好多人六点多就来排队结果到现在都没开始问就是等从来不通知开始时间这样搞不是人群更聚集了吗真要有病例一锅端了有个认识的要带娃上网课了等不了了把她的位置让给我了结果到了她的位置半天也没动就跑到前面问物业的人家玩手机头都不抬的说等	2
被封城的深圳居民胆子小说不得香港啊说了就是拉仇恨说了就是博眼球说了就是收美国钱分化两地港媒指责深圳封城影响供港棺材的新闻里又被扣帽子了好担心会不会封杀我	2
深圳房租不低昨晚看到一个视频是西乡突然封路外卖小哥在求放行他承诺不再接单了也是带着哭腔说不送到平台会先扣钱一天又白干了	2
深圳这几天外卖小哥活儿很多也很准点大部分情况下整条马路都是他们的	1
动不动就免职结果就是对下面一刀切	2
拜托拜托 救救城中村里的人吧	2
按时间算明天应该是小区解封日原计划早上9点半测核酸申请解封的但由于医护不足时间推迟到下午四点半菜开始测不过现在疫情这么严重解不解封也没什么区别此时此刻封控反而更安全自3月12日突增66例以来每天都创新高从668660到92什么时候才会压下来啊	2
周一能解封吗	0
我在想象疫情过后收到的快递就跟开盲盒一样我真的快忘记买了些啥了	2
我真的会谢全部衣服在sz封控区里然后回东莞这20天每天穿睡衣	2
救命做梦都是解封了吗上班吗	2
